course_url,title,level,description,topic_tags,learning_path
https://www.dicoding.com/academies/418-menjadi-react-web-developer-expert,Menjadi React Web Developer Expert,Level: Mahir,"React merupakan UI Library paling populer yang digunakan industri dalam membangun aplikasi web. Tantangan terbesar dalam membangun aplikasi React adalah memastikan aplikasi yang dibangun mudah dikelola, minim bugs, dan teruji. Untuk itu, React developer harus mampu menulis kode yang baik sesuai kaidah, mengelola state dengan baik agar perubahannya lebih terprediksi, dan memastikan aplikasi yang dibuat sudah diuji secara otomatis sebelum menyentuh tahap rilis.
State adalah hal yang paling krusial di React, sehingga React developer perlu mengetahui cara mengelola state dengan baik.
Redux merupakan tools yang banyak digunakan industri dalam mengelola state UI. Dengan menguasai Redux, developer bisa memperluas kesempatan untuk berkarier.
Pengujian aplikasi yang dilakukan secara manual tidak selamanya efektif. Developer harus belajar cara menguji aplikasi secara otomatis agar bisa mengetahui penyebab error secara cepat dan hemat waktu.
Proses deployment aplikasi yang dilakukan secara manual rentan terjadi kesalahan. Selain itu, aplikasi sering kali tidak diuji sebelum berjalan ditahap production. Sebagai React Developer, kita harus tahu cara deployment aplikasi yang efisien, aman, dan cepat dengan menggunakan teknik CI/CD.
Tingginya kebutuhan industri terhadap talenta digital yang paham dengan React.
Target dan Sasaran Siswa
Kelas ini ditujukan untuk React Developer yang ingin meningkatkan kemampuannya dalam penulisan kode yang baik, pengelolaan state dengan Redux, pengujian aplikasi secara otomatis, dan teknik deployment yang efisien, aman, dan cepat.
Kelas ini dapat diikuti oleh siswa yang sudah familier dengan fundamental pengembangan aplikasi React seperti React element, React component, React Context, React Hooks, dan React Router.
Siswa diharapkan sudah mampu mengembangkan aplikasi web di sisi Front-End, menguasai HTML, CSS, dan JavaScript serta sudah familier dengan sintaksis ES6.
Siswa harus bisa belajar mandiri, berkomitmen, benar-benar punya rasa ingin tahu, dan tertarik pada subjek materi, karena sebaik apa pun materi kelas ini, tidak akan berguna tanpa keseriusan siswa untuk belajar, berlatih, dan mencoba.
Di akhir kelas siswa dapat membuat aplikasi React dengan kode yang baik, pengelolaan state menggunakan Redux, diuji dan dideploy secara otomatis.","Full Stack, Front End",React
https://www.dicoding.com/academies/292-meniti-karier-sebagai-software-developer,Meniti Karier sebagai Software Developer,Level: Dasar,"Software Developer merupakan pekerjaan yang diimpikan banyak orang. Bahkan di Amerika, Software Developer telah berturut-turut selama 3 tahun berada di peringkat pertama ranking karier terbaik bidang teknologi milik World Report. Namun untuk meniti karier di bidang ini tidaklah mudah. Terdapat berbagai jalur yang masing-masing membutuhkan persiapan dan ilmu berbeda. Mempelajari sudut pandang developer yang sudah meniti karier sesuai bidangnya adalah cara tepat untuk menentukan arah yang perlu Anda ambil.
Saat ini perkembangan teknologi berkembang sangat pesat dan itu semua berkat campur tangan seorang Software Developer.
Dengan menjadi Software Developer, Anda dapat membuat aplikasi yang bermanfaat untuk banyak orang.
Kebutuhan Software Developer di Indonesia sangatlah tinggi. Riset World Bank mengatakan, “Untuk mendukung transformasi digital dan pertumbuhan ekonomi, Indonesia membutuhkan kurang lebih 600.000 talenta digital setiap tahunnya.”
Ada banyak kelebihan ketika menjadi Software Developer, seperti waktu kerja lebih fleksibel, memiliki gaji yang cukup tinggi, dapat bekerja secara independen, memiliki jaminan kerja. sosialisasi akan meningkat, dan kreativitas akan terasah.
Software Developer memiliki berbagai macam jalur yang bisa Anda pilih, seperti Android Developer, Front-End Web Developer, iOS Developer, Machine Learning Developer, dan masih banyak lagi.
Target dan Sasaran Siswa
Kelas ditujukan bagi pemula yang ingin memulai kariernya di bidang Software Developer dengan mengacu pada standar kompetensi industri.
Kelas dapat dikuti oleh siswa yang melek IT sehingga wajib memiliki dan dapat mengoperasikan komputer dengan baik.
Kelas ini didesain untuk pemula sehingga tidak ada prasyarat dalam pemahaman pemrograman sebelumnya.
Siswa harus bisa belajar mandiri, berkomitmen, benar-benar punya rasa ingin tahu, dan tertarik pada subjek materi, karena sebaik apa pun materi kelas ini, tidak akan berguna tanpa keseriusan siswa untuk belajar, berlatih, dan mencoba.
Tujuan Umum dan Khusus Pelatihan
Di akhir kelas, siswa dapat menyimpulkan dan memilih jalur karier pada bidang Software Development yang sesuai dengan diri mereka beserta mengerti hal-hal yang harus mereka persiapkan untuk mencapai dan menjalani karier tersebut.
Mengidentifikasi opsi jalur karier yang tersedia di bidang Software Development..
Menyimpulkan jalur karier yang tepat di bidang Software Development.
Menerapkan praktek terbaik dari developer berpengalaman untuk mengambil jalur karier.","iOS, Android",
https://www.dicoding.com/academies/302-pengenalan-ke-logika-pemrograman-programming-logic-101,Pengenalan ke Logika Pemrograman (Programming Logic 101),Level: Dasar,"Mengerti logika dan penerapannya dalam menyusun algoritma akan menjadi salah satu modal awal yang cukup untuk belajar pemrograman. Bidang pemrograman di Indonesia berpotensi mengalami pertumbuhan ekonomi tahunan yang menjanjikan melalui digitalisasi. Dengan mempelajari logika pemrograman yang disusun dalam algoritma terstruktur, Anda dapat menyelesaikan permasalahan dengan lebih cepat dan efisien baik di bidang pemrograman itu sendiri atau kehidupan sehari-hari.
Pemrograman merupakan top skill yang dibutuhkan di era industri digital saat ini.
Logika pemrograman dapat membantu Anda untuk lebih berpikir secara logis sehingga lebih efisien dalam pemecahan masalah.
Dengan menerapkan logika pemrograman yang disertai algoritma yang tepat, Anda dapat menyelesaikan masalah dengan lebih terstruktur.
Logika pemrograman adalah salah satu fondasi yang dapat membantu Anda melangkah lebih jauh di bidang pemrograman.""
Target dan Sasaran Siswa :
Kelas ditujukan bagi pemula yang ingin mulai belajar logika pada bidang pemrograman dengan mengacu pada standar industri.
Kelas dapat diikuti oleh siswa yang melek IT sehingga wajib memiliki dan dapat mengoperasikan komputer dengan baik.
Kelas ini didesain untuk pemula sehingga tidak ada prasyarat dalam pemahaman pemrograman sebelumnya.
Siswa harus bisa belajar mandiri, berkomitmen, benar-benar punya rasa ingin tahu, dan tertarik pada subjek materi, karena sebaik apa pun materi kelas ini, tidak akan berguna tanpa keseriusan siswa untuk belajar, berlatih, dan mencoba.",Data,
https://www.dicoding.com/academies/317-belajar-dasar-git-dengan-github,Belajar Dasar Git dengan GitHub,Level: Dasar,"GitHub adalah layanan host web bersama yang menggunakan sistem kendali versi Git dan layanan hosting internet. GitHub memberikan kontrol akses dan beberapa fitur kolaborasi seperti pelacakan bug, manajemen tugas, dan wiki untuk setiap proyek. GitHub menawarkan paket repositori pribadi dan gratis digunakan untuk proyek perangkat lunak open source (sumber terbuka). GitHub mempunyai lebih dari 40 juta pengguna dan 190 juta repositori yang menjadikannya layanan terbesar dari kode sumber di dunia.
GitHub adalah solusi wadah atau alat untuk berkolaborasi dengan tim ketika mengembangkan sebuah proyek repository.
GitHub dapat memuat profil dan proyek Anda sehingga dapat dijadikan portofolio dalam berkarier.
GitHub memiliki ratusan juta public repository yang dapat dijadikan referensi dalam mengembangkan perangkat lunak.
Target dan Sasaran Siswa
Kelas ini ditujukan bagi developer yang ingin mempelajari pengelolaan kode atau data menggunakan Git dengan GitHub agar bisa berkolaborasi dengan developer lain yang sesuai dengan standar industri.
Kelas dapat diikuti oleh siswa yang melek IT sehingga wajib memiliki dan dapat mengoperasikan komputer dengan baik.
Kelas ini didesain untuk pemula sehingga tidak ada prasyarat dalam pemahaman pemrograman sebelumnya. Namun, akan lebih baik jika memiliki pengetahuan dasar tentang pemrograman.
Siswa harus bisa belajar mandiri, berkomitmen, benar-benar punya rasa ingin tahu, dan tertarik pada subjek materi, karena sebaik apa pun materi kelas ini, tidak akan berguna tanpa keseriusan siswa untuk belajar, berlatih, dan mencoba.
Di akhir kelas, siswa dapat mengelola kumpulan data atau kode mereka sendiri dalam repository GitHub, serta dapat berkolaborasi dengan developer lain pada repository yang sama.",Data,
https://www.dicoding.com/academies/120-memulai-pemrograman-dengan-c,Memulai Pemrograman Dengan C,Level: Dasar,"Bahasa C adalah bahasa prosedural yang memiliki banyak kegunaan. Ia didesain untuk di-compile secara sederhana agar mendukung akses ke low-level memory, pendukung bahasa dalam instruksi mesin. Meskipun didesain secara minimal, C bisa digunakan sebagai bahasa multi-platform. Menurut GitHub, C adalah 1 dari 10 bahasa pemrogramman terbaik. Bahasa C sangatlah cocok bagi Anda yang ingin masuk ke dunia programming. Oleh karena itu, bahasa C sering digunakan sebagai bahasa pertama untuk belajar pemrograman.
Cocok bagi Anda yang belum pernah belajar bahasa pemrograman apa pun, karena C termasuk bahasa yang mudah untuk dipelajari.
Bahasa C bisa menjadi pijakan utama sebelum Anda belajar bahasa populer seperti C++/C#.
Bahasa C adalah bahasa yang multi-platform.
Bagi Anda yang tertarik dengan menggeluti programming di sistem hardware, C adalah salah satu bahasa yang direkomendasikan karena runtime-nya cepat.
Bahasa C masih relevan dengan kebutuhan industri saat ini.
Bahasa C menjadi salah satu dari 10 bahasa terbaik menurut GitHub.
Target dan Sasaran Siswa
Kelas ini ditujukan untuk pemula yang ingin mempelajari dasar pemrograman bahasa C dengan mengacu pada standar industri.
Kelas dapat diikuti oleh siswa yang melek IT sehingga wajib memiliki dan dapat mengoperasikan komputer dengan baik.
Kelas ini didesain untuk pemula sehingga tidak ada prasyarat dalam pemahaman pemrograman sebelumnya. Namun, akan lebih baik jika memiliki pengetahuan dasar tentang pemrograman.
Siswa harus bisa belajar mandiri, berkomitmen, benar-benar punya rasa ingin tahu, dan tertarik pada subjek materi, karena sebaik apa pun materi kelas ini, tidak akan berguna tanpa keseriusan siswa untuk belajar, berlatih, dan mencoba.
Di akhir kelas, siswa dapat membuat program C dengan menggunakan IDE Online seperti Glot.io atau Replit.",Programming Language,
https://www.dicoding.com/academies/177-belajar-dasar-visualisasi-data,Belajar Dasar Visualisasi Data,Level: Dasar,"Setiap perusahaan pasti memiliki data yang jumlahnya tidak sedikit. Menurut World Economic Forum, 90% dari data di dunia dibuat dalam rentang waktu 2 tahun terakhir. Dari begitu banyaknya data pasti semakin sulit untuk mengelola dan memahaminya. Di sinilah pentingnya visualisasi data yang berperan untuk mengubah data yang kompleks menjadi lebih mudah dipahami banyak orang. Bahkan sebagai seorang developer pun, skill visualisasi data dibutuhkan supaya dapat menceritakan dan mempresentasikan data yang ada.
Visualisasi data memudahkan untuk melihat tren dan cerita dari sebuah data.
Visualisasi data membantu dalam proses analisis data.
Visualisasi data membantu seorang developer untuk dapat mengomunikasikan data dengan lebih efektif.
Seiring perkembangan data yang semakin pesat, kebutuhan akan seorang yang ahli dalam visualisasi data sangat berperan penting untuk kemajuan perusahaan.
Visualisasi data merupakan salah satu skill yang sangat penting bagi orang yang bekerja dengan banyak data seperti pada pekerjaan machine learning.
Target dan Sasaran Siswa
Kelas ditujukan bagi pemula yang ingin memulai karirnya di bidang pengolahan data dengan mengacu pada standar kompetensi industri.
Kelas dapat diikuti oleh siswa yang melek IT sehingga wajib memiliki dan dapat mengoperasikan komputer dengan baik.
Kelas ini didesain untuk pemula sehingga tidak ada prasyarat dalam pemahaman pemrograman sebelumnya.
Siswa harus bisa belajar mandiri, berkomitmen, benar-benar punya rasa ingin tahu, dan tertarik pada subjek materi, karena sebaik apa pun materi kelas ini, tidak akan berguna tanpa keseriusan siswa untuk belajar, berlatih, dan mencoba.
Tujuan Umum dan Khusus Pelatihan
Di akhir kelas, siswa dapat membuat sebuah visualisasi data yang efektif menggunakan Google Sheets sesuai teknik praktik terbaik industri, sehingga meningkatkan nilainya dalam berkarier sebagai Software Developer.
Mengidentifikasi macam-macam media untuk visualisasi data.
Menyimpulkan jenis visualisasi data yang terbaik berdasarkan situasi dan kebutuhannya.
Membangun visualisasi data menggunakan aplikasi spreadsheet Google Sheets.
Menerapkan praktek terbaik seperti prinsip Gestalt, konsep Preattentive Attributes, dan konsep teori desain, dalam membangun visualisasi data.",Data,Machine Learning Engineer
https://www.dicoding.com/academies/86-memulai-pemrograman-dengan-python,Memulai Pemrograman dengan Python,Level: Dasar,"Python adalah bahasa pemrograman interpretatif yang dapat digunakan di berbagai platform dengan filosofi perancangan yang berfokus pada tingkat keterbacaan kode dan merupakan bahasa populer yang berkaitan dengan Data Science dan Machine Learning. Keunggulan Python yang bersifat interpretatif juga banyak digunakan untuk prototyping, scripting dalam pengelolaan infrastruktur, hingga pembuatan website berskala besar. Dengan kemudahan Python tersebut, sering dijadikan bahasa pertama untuk belajar pemrograman.
Bahasa Python menjadi keharusan untuk Anda yang ingin mempelajari dasar-dasar pemrograman, mulai dari scripting, pengolahan data, hingga machine learning.
Bahasa Python digunakan secara luas dan masuk dalam bahasa pemrograman populer beberapa tahun belakangan.
Pustaka (library) yang luas, memungkinkan Anda mengembangkan ke bidang-bidang lainnya. Beberapa library atau framework terpopuler data science dan machine learning menggunakan Python antara lain: Scikit-Learn, TensorFlow, PyTorch.
Bahasa Python memiliki kurva pembelajaran (learning-curve) yang sangat landai, cocok untuk dipelajari sebagai bahasa pemrograman pertama - dengan kemudahan pembacaan dan kemudahan mempelajari sintaksisnya.
Target dan Sasaran Siswa
Kelas ditujukan bagi pemula yang ingin belajar dasar pemrograman Python dengan mengacu pada standar industri.
Kelas dapat diikuti oleh siswa yang melek IT sehingga wajib memiliki dan dapat mengoperasikan komputer dengan baik.
Kelas ini didesain untuk pemula sehingga tidak ada prasyarat khusus dalam pemahaman pemrograman sebelumnya. Namun, memiliki pengetahuan matematika dasar dan logika pemrograman akan mempermudah pembelajaran.
Siswa harus bisa belajar mandiri, berkomitmen, benar-benar punya rasa ingin tahu, dan tertarik pada subjek materi, karena sebaik apa pun materi kelas ini, tidak akan berguna tanpa keseriusan siswa untuk belajar, berlatih, dan mencoba.
Di akhir kelas, siswa mampu membuat program dengan Python menggunakan berbagai IDE yang telah dipelajari, seperti Visual Studio Code, Jupyter Notebook, dan Google Colaboratory.",Programming Language,"Machine Learning Engineer, Data Scientist"
https://www.dicoding.com/academies/184-belajar-machine-learning-untuk-pemula,Belajar Machine Learning untuk Pemula,Level: Pemula,"Data telah menjadi aset berharga di era digital ini. Pemrosesan data mengubah informasi mentah menjadi wawasan yang bernilai untuk pengambilan keputusan yang tepat. Sebagai Machine Learning Engineer, Anda akan mempelajari teknik machine learning untuk menemukan pola dalam kumpulan data. Ini memungkinkan kita untuk mengembangkan model prediksi secara cepat. Kelas ini akan membekali Anda dengan pengetahuan untuk mengolah data menjadi informasi yang relevan.
Machine learning memiliki potensi untuk meningkatkan efisiensi dalam berbagai jenis pekerjaan secara signifikan.
Penguasaan terhadap machine learning dapat diterapkan di berbagai sektor, seperti kesehatan, keuangan, dan ritel, menjadikannya alat yang sangat fleksibel.
Kelas ini membekali Anda untuk mengolah dan menganalisis data, baik yang besar maupun kecil, menjadi wawasan yang bermanfaat.
Dengan meningkatnya kebutuhan akan profesional di bidang machine learning, permintaan untuk praktisi terampil semakin tinggi.
Memahami konsep dan teknik machine learning merupakan fondasi penting bagi siapa saja yang ingin berkarier sebagai Machine Learning Engineer atau Data Scientist, membuka peluang karier yang menjanjikan.
Target dan Sasaran Siswa
Kelas ini dirancang untuk pemula yang ingin memulai karier di bidang Machine Learning dengan mengikuti standar kompetensi industri terkini.
Kelas dapat diikuti oleh siswa yang melek IT sehingga wajib memiliki dan dapat mengoperasikan komputer dengan baik.
Kelas ini terbuka bagi siswa yang sudah familier dengan teknologi informasi sehingga diharapkan memiliki keterampilan dasar dalam mengoperasikan komputer.
Siswa harus bisa belajar mandiri, berkomitmen, benar-benar punya rasa ingin tahu, dan tertarik pada subjek materi, karena sebaik apa pun materi kelas ini, tidak akan berguna tanpa keseriusan siswa untuk belajar, berlatih, dan mencoba.
Setelah menyelesaikan kelas ini, siswa diharapkan memiliki kemampuan untuk mengembangkan proyek machine learning yang berfokus pada klasifikasi, regresi, dan clustering pada data tabular.","AI, Machine Learning","Machine Learning Engineer, Data Scientist"
https://www.dicoding.com/academies/185-belajar-fundamental-deep-learning,Belajar Fundamental Deep Learning,Level: Menengah,"Permintaan untuk Machine Learning Engineer telah meningkat pesat dalam beberapa tahun terakhir. Diakui sebagai pekerjaan kelima paling diminati pada tahun 2023, ML Engineer sangat dicari oleh banyak perusahaan. Menurut
Biro Statistik Tenaga Kerja AS
, pekerjaan ini akan tumbuh 23% hingga 2032. Perusahaan-perusahaan seperti Google, Meta, dan Amazon telah mengadopsi teknologi machine learning untuk mengoptimalkan pengalaman pengguna berdasarkan data minat dan aktivitas pengguna.
Keterampilan deep learning sangat dicari oleh berbagai industri, membuka peluang karier dengan gaji yang menarik.
Deep learning digunakan dalam berbagai bidang seperti pengenalan gambar, analisis sentimen, kendaraan otonom, dan diagnosis medis.
Kelas ini memberikan keterampilan praktis dalam mengembangkan dan menerapkan model deep learning, meningkatkan kemampuan teknis Anda.
Kebutuhan karier di bidang Machine Learning sangatlah tinggi dan jumlah praktisinya juga masih sedikit sehingga peluangnya masih sangat besar.
Pemahaman tentang pengembangan machine learning wajib dimiliki oleh seorang Machine Learning Engineer ataupun Data Scientist.
Target dan Sasaran Siswa
Kelas ditujukan bagi Machine Learning Engineer yang ingin mempelajari tentang computer vision, natural language processing, serta deployment dengan standar mengacu pada standar kompetensi industri.
Kelas dapat diikuti oleh siswa yang melek IT sehingga wajib memiliki dan dapat mengoperasikan komputer dengan baik.
Anda diharapkan sudah memahami konsep dan cara kerja machine learning, membedakan supervised dan unsupervised learning, serta penerapan supervised dan unsupervised learning dengan algoritma shallow learning.
Siswa harus bisa belajar mandiri, berkomitmen, benar-benar punya rasa ingin tahu, dan tertarik pada subjek materi, karena sebaik apa pun materi kelas ini, tidak akan berguna tanpa keseriusan siswa untuk belajar, berlatih, dan mencoba.
Setelah mengikuti kelas, siswa diharapkan mampu membangun proyek deep learning yang berfokus pada pengolahan dan prediksi data teks serta gambar.","AI, Machine Learning","Machine Learning Engineer, Data Scientist"
https://www.dicoding.com/academies/319-machine-learning-terapan,Machine Learning Terapan,Level: Mahir,"Menurut riset yang berjudul 2020 Emerging Job Report, trend perekrutan untuk peran AI specialist tumbuh 74% selama 4 tahun terakhir. AI specialist dinobatkan sebagai peringkat pertama the most emerging job in the US in 2020. Di Indonesia, AI specialist juga menempati urutan pertama. Hal ini karena otomatisasi telah mengubah cara orang hidup dan bekerja setiap harinya. Posisi Machine Learning Engineer sangat dicari. Sehingga, di Amerika, posisi ini bisa mendapatkan pekerjaan senilai Rp 1,9 miliar per tahun (Kompas).
Machine Learning dapat digunakan untuk meningkatkan efisiensi dari berbagai pekerjaan.
Machine Learning dapat diimplementasikan ke berbagai industri dan berbagai jenis data sehingga kegunaannya sangat luas.
Banyak perusahaan memiliki jumlah data yang sangat besar sehingga perlu diproses dengan machine learning untuk mendapatkan informasi  yang berarti.
Kebutuhan karier di bidang Machine Learning sangatlah tinggi karena jumlah praktisi yang masih sedikit sehingga peluangnya masih sangat besar.
Pemahaman tentang Machine Learning, TensorFlow, dan Keras adalah keharusan untuk menjadi seorang Machine Learning Engineer ataupun Data Scientist.
Mengerjakan proyek-proyek Machine Learning sebagai portofolio merupakan keahlian yang harus dimiliki untuk mereka yang ingin memulai karier menjadi Machine Learning Engineer.
Target dan Sasaran Siswa
Kelas ditujukan bagi Machine Learning Engineer yang ingin mempelajari tentang terapan machine learning di berbagai bidang, model predictive analytics, sentiment analisis, computer vision, serta sistem rekomendasi dengan standar mengacu pada standar kompetensi industri.
Kelas dapat diikuti oleh siswa yang melek IT sehingga wajib memiliki dan dapat mengoperasikan komputer dengan baik.
Kelas ini didesain untuk siswa yang sudah memiliki pengetahuan dasar mengenai machine learning, seperti supervised dan unsupervised learning, SVM, neural network, dan deployment.
Siswa harus bisa belajar mandiri, berkomitmen, benar-benar punya rasa ingin tahu, dan tertarik pada subjek materi, karena sebaik apa pun materi kelas ini, tidak akan berguna tanpa keseriusan siswa untuk belajar, berlatih, dan mencoba.
Di akhir kelas, siswa dapat membuat model predictive analytics untuk bisnis dan marketing, sentiment analysis, computer vision
untuk pengenalan gambar dan deteksi objek pada gambar
, serta sistem rekomendasi.","AI, Machine Learning",Machine Learning Engineer
https://www.dicoding.com/academies/60-memulai-pemrograman-dengan-java,Memulai Pemrograman Dengan Java,Level: Dasar,"Java merupakan bahasa yang diciptakan oleh James Gosling di tahun 1990-an. Java muncul sebagai bahasa yang dapat dijalankan di berbagai platform tanpa perlu re-kompilasi. Berdasarkan TIOBE Programming Community Index, Java masih merupakan salah satu bahasa pemrograman terpopuler di dunia. Oracle menyatakan 90% perusahaan terkemuka pada daftar Fortune 500 pernah menggunakan bahasa Java. Selain itu, Java juga dapat digunakan untuk mengembangkan aplikasi pada platform desktop, web, mobile, embedded, dan IoT.
Bahasa Java merupakan bahasa terpopuler yang pernah digunakan oleh 90% perusahaan ternama.
Dengan bahasa Java, Anda dapat mengembangkan aplikasi untuk platform desktop, web, mobile, hingga embedded dan IoT.
Siapa pun Anda, jika ingin menjadi Java Developer harus memiliki pengetahuan dasar pemrograman Java seperti Java Dasar, Control Flow, Collection Type, dan Object-Oriented Programming.
Penggunaan bahasa Java itu gratis (open source), sehingga siapa saja dapat mempelajari dan menggunakannya.
Berdasarkan TIOBE Programming Community Index, Java masih menjadi salah satu bahasa pemrograman terpopuler di dunia.
Target dan Sasaran Siswa
Kelas ini ditujukan untuk pemula yang ingin mempelajari dasar pemrograman bahasa Java dengan mengacu pada standar industri.
Kelas dapat diikuti oleh siswa yang melek IT sehingga wajib memiliki dan dapat mengoperasikan komputer dengan baik.
Kelas ini didesain untuk pemula sehingga tidak ada prasyarat dalam pemahaman pemrograman sebelumnya. Namun, akan lebih baik jika memiliki pengetahuan dasar tentang pemrograman.
Siswa harus bisa belajar mandiri, berkomitmen, benar-benar punya rasa ingin tahu, dan tertarik pada subjek materi, karena sebaik apa pun materi kelas ini, tidak akan berguna tanpa keseriusan siswa untuk belajar, berlatih, dan mencoba.
Di akhir kelas, siswa dapat membuat program Java dengan menggunakan IDE Intellij Idea atau IDE Online seperti Glot.io atau Replit.","Android, Flutter",
